{
  "schemaVersion": 1,
  "datasetStatus": "phase-1-public-import",
  "lastReviewed": "2026-09-20",
  "patch": "2026-09-17-a-study-in-gray",
  "region": "asia",
  "source": [
    {
      "type": "official-current-update",
      "url": "https://www.starsavior.com/en/news/01a08a00-309f-76e5-a37a-3d1973d934a5",
      "verifiedInClient": false
    },
    {
      "type": "kr-jp-character-database",
      "url": "https://tychara.com/StarSavior/characterlist/",
      "sourceLastUpdated": "2026-06-29",
      "verifiedInClient": false
    },
    {
      "type": "public-mechanics-reference",
      "url": "https://starsavior-db.pages.dev/mechanics/",
      "verifiedInClient": false
    }
  ],
  "notes": [
    "目标版本为 2026-09-17 的 A Study in Gray 亚服线上版本。",
    "角色页来源主要覆盖韩服和日服，尚未在亚服客户端逐条验证。",
    "2026-09-23 已宣布但尚未上线的平衡改动保存在 data/patches 目录，不应用于当前基线。",
    "角色技能说明为中文结构化摘要，技能名称保留公开资料中的英文名称。"
  ],
  "characters": [
    {
      "id": "lacy",
      "rosterId": "lacy",
      "name": "Lacy",
      "aliases": [],
      "rarity": "SSR",
      "class": "ranger",
      "element": "chaos",
      "roles": ["ranger", "control"],
      "tags": ["single-target", "area-damage", "entangled-dream", "action-gauge", "self-heal"],
      "stats": { "attack": 3255, "vitality": 18560, "defense": 1435, "speed": 115, "criticalHitRate": 5, "criticalDamage": 50, "effectHit": 112, "effectResistance": 0, "hitRate": 100 },
      "skills": ["lacy-passive", "lacy-basic", "lacy-special", "lacy-hyper"],
      "verification": "observed-public",
      "dataCompleteness": "full-public-page",
      "sources": ["https://tychara.com/StarSavior/characters/lacy/"]
    },
    { "id": "bellis", "rosterId": null, "name": "Bellis", "aliases": [], "rarity": null, "class": null, "element": null, "roles": [], "tags": [], "stats": { "speed": null }, "skills": [], "verification": "observed-public", "dataCompleteness": "metadata-only", "sources": ["https://vortexgaming.io/en/postdetail/714181"] },
    { "id": "seira", "rosterId": "seira", "name": "Seira", "aliases": [], "rarity": null, "class": null, "element": null, "roles": [], "tags": [], "stats": { "speed": null }, "skills": [], "verification": "observed-public", "dataCompleteness": "metadata-only", "sources": ["https://tychara.com/StarSavior/characterlist/"] },
    { "id": "taya", "rosterId": null, "name": "Taya", "aliases": [], "rarity": null, "class": null, "element": null, "roles": [], "tags": [], "stats": { "speed": null }, "skills": [], "verification": "observed-public", "dataCompleteness": "metadata-only", "sources": ["https://vortexgaming.io/en/postdetail/714181"] },
    { "id": "emily", "rosterId": "emily", "name": "Emily", "aliases": ["Emilly"], "rarity": null, "class": null, "element": null, "roles": [], "tags": [], "stats": { "speed": null }, "skills": [], "verification": "observed-public", "dataCompleteness": "metadata-only", "sources": ["https://vortexgaming.io/en/postdetail/714181"] },
    {
      "id": "claire",
      "rosterId": "claire-candle-square",
      "name": "Claire",
      "aliases": [],
      "rarity": "SR",
      "class": "striker",
      "element": "moon",
      "roles": ["striker"],
      "tags": ["single-target", "critical", "action-gauge", "self-buff"],
      "stats": { "attack": 2977, "vitality": 15692, "defense": 1225, "speed": 90, "criticalHitRate": 5, "criticalDamage": 68, "effectHit": 100, "effectResistance": 12, "hitRate": 100 },
      "skills": ["claire-passive", "claire-basic", "claire-special", "claire-hyper"],
      "verification": "observed-public",
      "dataCompleteness": "full-public-page",
      "sources": ["https://tychara.com/StarSavior/characters/claire/"]
    },
    { "id": "roberta", "rosterId": "roberta", "name": "Roberta", "aliases": [], "rarity": null, "class": null, "element": null, "roles": [], "tags": [], "stats": { "speed": null }, "skills": [], "verification": "observed-public", "dataCompleteness": "metadata-only", "sources": ["https://tychara.com/StarSavior/characterlist/"] },
    { "id": "muriel", "rosterId": "muriel", "name": "Muriel", "aliases": [], "rarity": null, "class": null, "element": null, "roles": [], "tags": [], "stats": { "speed": null }, "skills": [], "verification": "observed-public", "dataCompleteness": "metadata-only", "sources": ["https://tychara.com/StarSavior/characterlist/"] },
    { "id": "bunny-girl-charle", "rosterId": null, "name": "Bunny Girl Charle", "aliases": ["Charle"], "rarity": null, "class": null, "element": null, "roles": [], "tags": [], "stats": { "speed": null }, "skills": [], "verification": "observed-public", "dataCompleteness": "metadata-only", "sources": ["https://vortexgaming.io/en/postdetail/714181"] },
    {
      "id": "asherah",
      "rosterId": "asherah-voyager-savior-party",
      "name": "Asherah",
      "aliases": [],
      "rarity": "SSR",
      "class": "striker",
      "element": "moon",
      "roles": ["striker", "control"],
      "tags": ["area-damage", "chill", "critical", "speed-buff", "critical-buff"],
      "stats": { "attack": 3005, "vitality": 20086, "defense": 1560, "speed": 104, "criticalHitRate": 5, "criticalDamage": 50, "effectHit": 100, "effectResistance": 0, "hitRate": 100 },
      "skills": ["asherah-passive", "asherah-basic", "asherah-special", "asherah-hyper"],
      "verification": "observed-public",
      "dataCompleteness": "full-public-page",
      "sources": ["https://tychara.com/StarSavior/characters/asherah/"]
    },
    {
      "id": "omega",
      "rosterId": "omega",
      "name": "Omega",
      "aliases": [],
      "rarity": "SSR",
      "class": "caster",
      "element": "star",
      "roles": ["caster"],
      "tags": ["area-damage", "follow-up", "self-buff", "stack"],
      "stats": { "attack": 3442, "vitality": 19211, "defense": 1429, "speed": 96, "criticalHitRate": 5, "criticalDamage": 50, "effectHit": 100, "effectResistance": 0, "hitRate": 100 },
      "skills": ["omega-passive", "omega-basic", "omega-special", "omega-hyper"],
      "verification": "observed-public",
      "dataCompleteness": "full-public-page",
      "sources": ["https://tychara.com/StarSavior/characters/omega/"]
    },
    {
      "id": "tanya",
      "rosterId": "tanya",
      "name": "Tanya",
      "aliases": [],
      "rarity": "SSR",
      "class": "striker",
      "element": "star",
      "roles": ["striker"],
      "tags": ["single-target", "toughness-break", "action-gauge", "team-buff"],
      "stats": { "attack": 3399, "vitality": 19381, "defense": 1505, "speed": 100, "criticalHitRate": 5, "criticalDamage": 50, "effectHit": 100, "effectResistance": 0, "hitRate": 100 },
      "skills": ["tanya-passive", "tanya-basic", "tanya-special", "tanya-hyper"],
      "verification": "observed-public",
      "dataCompleteness": "full-public-page",
      "sources": ["https://tychara.com/StarSavior/characters/tanya/"]
    },
    {
      "id": "charlotte",
      "rosterId": "charlotte-monastir-knights",
      "name": "Charlotte",
      "aliases": [],
      "rarity": "SSR",
      "class": "striker",
      "element": "sun",
      "roles": ["striker", "support"],
      "tags": ["single-target", "ally-buff", "extra-turn", "attack-down", "action-gauge"],
      "stats": { "attack": 3456, "vitality": 19381, "defense": 1434, "speed": 104, "criticalHitRate": 5, "criticalDamage": 50, "effectHit": 100, "effectResistance": 0, "hitRate": 100 },
      "skills": ["charlotte-passive", "charlotte-basic", "charlotte-special", "charlotte-hyper"],
      "verification": "observed-public",
      "dataCompleteness": "full-public-page",
      "sources": ["https://tychara.com/StarSavior/characters/charlotte/"]
    },
    {
      "id": "bell-rhys",
      "rosterId": "bell",
      "name": "Bell Rhys",
      "aliases": ["Bell"],
      "rarity": "SSR",
      "class": "ranger",
      "element": "star",
      "roles": ["ranger", "control"],
      "tags": ["area-damage", "silence", "remove-buff", "accuracy-down", "action-gauge"],
      "stats": { "attack": 3230, "vitality": 18420, "defense": 1434, "speed": 112, "criticalHitRate": 5, "criticalDamage": 50, "effectHit": 112, "effectResistance": 0, "hitRate": 100 },
      "skills": ["bell-rhys-passive", "bell-rhys-basic", "bell-rhys-special", "bell-rhys-hyper"],
      "verification": "observed-public",
      "dataCompleteness": "full-public-page",
      "sources": ["https://tychara.com/StarSavior/characters/bellrhys/"]
    },
    {
      "id": "scarlet",
      "rosterId": "scarlet-candle-square",
      "name": "Scarlet",
      "aliases": [],
      "rarity": "SR",
      "class": "ranger",
      "element": "sun",
      "roles": ["ranger"],
      "tags": [],
      "stats": { "attack": 2940, "vitality": 16632, "defense": 1230, "speed": 100, "criticalHitRate": 5, "criticalDamage": 50, "effectHit": 112, "effectResistance": 0, "hitRate": 100 },
      "skills": [],
      "verification": "observed-public",
      "dataCompleteness": "partial-public-page",
      "sources": ["https://tychara.com/StarSavior/characters/scarlet/"]
    },
    {
      "id": "harley",
      "rosterId": "harley",
      "name": "Harley",
      "aliases": [],
      "rarity": "SSR",
      "class": "defender",
      "element": "sun",
      "roles": ["defender"],
      "tags": [],
      "stats": { "attack": 2990, "vitality": 20220, "defense": 1484, "speed": 99, "criticalHitRate": 5, "criticalDamage": 50, "effectHit": 100, "effectResistance": 12, "hitRate": 100 },
      "skills": [],
      "verification": "observed-public",
      "dataCompleteness": "partial-public-page",
      "sources": ["https://tychara.com/StarSavior/characters/harley/"]
    },
    {
      "id": "smile",
      "rosterId": "smile-voyager-savior-party",
      "name": "Smile",
      "aliases": [],
      "rarity": "SSR",
      "class": "ranger",
      "element": "star",
      "roles": ["ranger"],
      "tags": ["single-target", "area-damage", "leap", "burn", "defense-down", "action-gauge"],